[
  {
    "id": "a1b2c3d4-0001-0001-0001-000000000001",
    "name": "Goblin",
    "dangerLevel": 1,
    "type": "Standard",
    "size": "Small",
    "faction": "Crimson Horde",
    "xp": 15,
    "hp": 12,
    "ar": 12,
    "dr": 14,
    "mr": 12,
    "av": 0,
    "spd": 12,
    "dmg": 2,
    "damageDie": "1d6",
    "traitIds": [],
    "powerIds": ["ma-0001"]
  },
  {
    "id": "a1b2c3d4-0002-0002-0002-000000000002",
    "name": "Zombie",
    "dangerLevel": 2,
    "type": "Standard",
    "size": "Medium",
    "faction": "The Risen",
    "xp": 30,
    "hp": 18,
    "ar": 12,
    "dr": 15,
    "mr": 13,
    "av": 0,
    "spd": 11,
    "dmg": 2,
    "damageDie": "1d6",
    "traitIds": ["ma-0002"],
    "powerIds": []
  },
  {
    "id": "a1b2c3d4-0003-0003-0003-000000000003",
    "name": "Shade",
    "dangerLevel": 3,
    "type": "Standard",
    "size": "Medium",
    "faction": "The Risen",
    "xp": 50,
    "hp": 20,
    "ar": 13,
    "dr": 16,
    "mr": 14,
    "av": 0,
    "spd": 14,
    "dmg": 3,
    "damageDie": "1d8",
    "traitIds": ["ma-0003"],
    "powerIds": ["ma-0004"]
  },
  {
    "id": "a1b2c3d4-0004-0004-0004-000000000004",
    "name": "Vampire Lord",
    "dangerLevel": 8,
    "type": "Elite",
    "size": "Medium",
    "faction": "The Risen",
    "xp": 275,
    "hp": 70,
    "ar": 16,
    "dr": 21,
    "mr": 19,
    "av": 3,
    "spd": 16,
    "dmg": 8,
    "damageDie": "2d6",
    "traitIds": ["ma-0005"],
    "powerIds": ["ma-0006", "ma-0007"]
  }
]
